{
  "schemaVersion": "1.0.0",
  "seriesId": "P5-LUNA-HARNESS",
  "runId": "p5-pilot-02-codex-r2",
  "harness": "codex",
  "stackMode": "core-parity",
  "reference": "dd00b33f039b4c6d291b1c241aaae9eb66ba4b85",
  "configFingerprint": "01704a914c7995dd7271e9b9ffcef8d8ef4675472239ee5c5a391f0a750bc02a",
  "promptFingerprint": "afcc7666b86888b18a75e524298e3e7ba07b0d509b62139eab68d63bf9c5b127",
  "resolvedRoles": {
    "main": {
      "enabled": true,
      "invoked": true,
      "model": "gpt-5.6-luna",
      "thinking": "high",
      "provider": "codex-cli"
    }
  },
  "evaluator": {
    "status": "pass",
    "correctness": {
      "fixtureTestExitCode": 0,
      "assertionsPassed": 2,
      "assertionsFailed": 0
    },
    "antiGaming": {
      "outOfScopeChanges": [],
      "fixtureTestEdited": false,
      "note": "fixtureTestEdited=true means run-fixture-test.mjs itself was modified — see TASK.md Abbruchbedingungen (forcing a pass by editing the test itself)."
    },
    "summary": "Fixture test passed (both hunk-merge assertions).",
    "evaluatorFingerprint": "p5-02-local-bug-v1",
    "inputFingerprint": "p5-02-local-bug-fixture-v1",
    "durationMs": 97,
    "visibleTestChanges": [],
    "benchmarkChanges": []
  },
  "inputFingerprint": "p5-02-local-bug-fixture-v1",
  "automaticMetrics": {
    "schemaVersion": "1.1.0-codex",
    "task": "02-local-bug",
    "collectedAt": "2026-08-31T17:06:33.148Z",
    "automatic": {
      "modelCalls": 7,
      "tokens": {
        "input": 974550,
        "output": 3898,
        "reasoning": 1227,
        "cacheRead": 920064,
        "cacheWrite": 0,
        "providerReportedTotal": 978448
      },
      "failedToolCalls": 2,
      "repeatedIdenticalFailures": null,
      "userCorrectionTurns": null,
      "durationMs": 162121,
      "durationMsSource": "rollout-timestamps",
      "subagentCalls": 0,
      "subagentModelCalls": 0,
      "subagentTokens": {
        "input": 0,
        "output": 0,
        "reasoning": 0,
        "cacheRead": null,
        "cacheWrite": null,
        "providerReportedTotal": 0
      },
      "subagentDurationMsTotal": 0,
      "subagentFailures": 0,
      "toolCallCount": 8,
      "diff": null,
      "verify": null
    },
    "manualAssessment": {
      "solvedWithoutCorrection": null,
      "unnecessaryLineChangesWithinScope": null,
      "lostRequirements": null,
      "repeatedFailuresWithoutContextChange": null,
      "decisionPersistenceAfterCompaction": null,
      "projectStatusCorrectness": null,
      "hallucinationCount": null,
      "notes": null
    }
  },
  "diff": {
    "schemaVersion": "1",
    "head": "56f6768868a7ac6d08c890bf662c4c4d68c5e2ec",
    "staged": [],
    "unstaged": [
      {
        "status": "M",
        "path": "benchmark-fixture/diff-viewer/diff-algorithm.ts"
      }
    ],
    "untracked": [],
    "renames": [],
    "deletions": [],
    "changedFiles": [
      "benchmark-fixture/diff-viewer/diff-algorithm.ts"
    ],
    "fingerprint": "7ae0596d4ef2bc9219f1fb25ca44754b33cb29630f4369c67ec62dd89d6e1c30",
    "diffFingerprint": "7ae0596d4ef2bc9219f1fb25ca44754b33cb29630f4369c67ec62dd89d6e1c30",
    "visibleTestChanges": [],
    "benchmarkChanges": []
  },
  "networkToolCallsObserved": 0
}
