{
  "schemaVersion": "1.0.0",
  "seriesId": "P5-LUNA-HARNESS",
  "runId": "p5-pilot-05-pi-r2",
  "harness": "pi",
  "stackMode": "core-parity",
  "reference": "dd00b33f039b4c6d291b1c241aaae9eb66ba4b85",
  "configFingerprint": "c944fb47d9c595a1fe90fd5376a293f7306ab6a7852a09f1af3a1198206c1b35",
  "promptFingerprint": "510f0c721cb92aeadd6d5f279ccc18c252e749efca438aab3156285b141e76d9",
  "resolvedRoles": {
    "main": {
      "enabled": true,
      "invoked": true,
      "model": "openai-codex/gpt-5.6-luna",
      "thinking": "high",
      "provider": "openai-codex"
    },
    "investigator": {
      "enabled": true,
      "invoked": false
    },
    "debugger": {
      "enabled": true,
      "invoked": false
    },
    "verifier": {
      "enabled": false
    }
  },
  "evaluator": {
    "status": "pass",
    "correctness": {
      "fixtureTestExitCode": 0,
      "assertionsPassed": 11,
      "assertionsFailed": 0,
      "targetFileChanged": true
    },
    "antiGaming": {
      "note": "manual review still required (types.ts/behavioral-fidelity check outside test coverage). targetFileChanged=false means the fixture's baseline passed without any real edit — not a genuine solve."
    },
    "summary": "Fixture test passed (11/11 assertions) and the target file was actually modified.",
    "evaluatorFingerprint": "p5-05-refactor-v1",
    "inputFingerprint": "p5-05-refactor-fixture-v1",
    "durationMs": 92,
    "visibleTestChanges": [],
    "benchmarkChanges": []
  },
  "inputFingerprint": "p5-05-refactor-fixture-v1",
  "automaticMetrics": {
    "schemaVersion": "1.1.0",
    "task": "05-refactor-no-behavior-change",
    "collectedAt": "2026-08-31T16:52:28.346Z",
    "automatic": {
      "modelCalls": 14,
      "tokens": {
        "input": 62354,
        "output": 5984,
        "reasoning": 1774,
        "cacheRead": 320512,
        "cacheWrite": 0,
        "providerReportedTotal": 388850
      },
      "failedToolCalls": 2,
      "repeatedIdenticalFailures": 0,
      "userCorrectionTurns": 0,
      "durationMs": 741687,
      "subagentCalls": 0,
      "subagentModelCalls": 0,
      "subagentTokens": {
        "input": 0,
        "output": 0,
        "reasoning": 0,
        "cacheRead": 0,
        "cacheWrite": 0,
        "providerReportedTotal": 0
      },
      "subagentDurationMsTotal": 0,
      "subagentFailures": 0,
      "diff": null,
      "verify": null
    },
    "manualAssessment": {
      "solvedWithoutCorrection": null,
      "unnecessaryLineChangesWithinScope": null,
      "lostRequirements": null,
      "repeatedFailuresWithoutContextChange": null,
      "decisionPersistenceAfterCompaction": null,
      "projectStatusCorrectness": null,
      "hallucinationCount": null,
      "notes": null
    }
  },
  "diff": {
    "schemaVersion": "1",
    "head": "77274c8400777e743ba151ca41ad8b3936743067",
    "staged": [],
    "unstaged": [
      {
        "status": "M",
        "path": "benchmark-fixture/diff-viewer/change-tracker.ts"
      }
    ],
    "untracked": [],
    "renames": [],
    "deletions": [],
    "changedFiles": [
      "benchmark-fixture/diff-viewer/change-tracker.ts"
    ],
    "fingerprint": "7617b8f8dbf226d1f7dec61c6cd10a49d768c5d657a14ed24ea1daf23e8aa09b",
    "diffFingerprint": "7617b8f8dbf226d1f7dec61c6cd10a49d768c5d657a14ed24ea1daf23e8aa09b",
    "visibleTestChanges": [],
    "benchmarkChanges": []
  },
  "networkToolCallsObserved": 0
}
