{
  "schemaVersion": "1.0.0",
  "seriesId": "P5-LUNA-HARNESS",
  "runId": "p5-smoke-05-codex",
  "harness": "codex",
  "stackMode": "core-parity",
  "reference": "dd00b33f039b4c6d291b1c241aaae9eb66ba4b85",
  "configFingerprint": "55d07c4fff3cc27015211794a0615ce61d2c93d5e934cac5671a14ecd2f291c5",
  "promptFingerprint": "510f0c721cb92aeadd6d5f279ccc18c252e749efca438aab3156285b141e76d9",
  "resolvedRoles": {
    "main": {
      "enabled": true,
      "invoked": true,
      "model": "gpt-5.6-luna",
      "thinking": "high",
      "provider": "codex-cli"
    }
  },
  "evaluator": {
    "status": "pass",
    "correctness": {
      "fixtureTestExitCode": 0,
      "assertionsPassed": 11,
      "assertionsFailed": 0
    },
    "antiGaming": {
      "note": "manual review still required (types.ts/behavioral-fidelity check outside test coverage)"
    },
    "summary": "Fixture test passed (11/11 assertions).",
    "evaluatorFingerprint": "p5-05-refactor-v1",
    "inputFingerprint": "p5-05-refactor-fixture-v1",
    "durationMs": 73,
    "visibleTestChanges": [],
    "benchmarkChanges": []
  },
  "inputFingerprint": "p5-05-refactor-fixture-v1",
  "automaticMetrics": {
    "schemaVersion": "1.1.0-codex",
    "task": "05-refactor-no-behavior-change",
    "collectedAt": "2026-08-31T15:48:28.774Z",
    "automatic": {
      "modelCalls": 6,
      "tokens": {
        "input": 482036,
        "output": 3560,
        "reasoning": 1717,
        "cacheRead": 437504,
        "cacheWrite": 0,
        "providerReportedTotal": 485596
      },
      "failedToolCalls": 1,
      "repeatedIdenticalFailures": null,
      "userCorrectionTurns": null,
      "durationMs": 460597,
      "durationMsSource": "rollout-timestamps",
      "subagentCalls": 0,
      "subagentModelCalls": 0,
      "subagentTokens": {
        "input": 0,
        "output": 0,
        "reasoning": 0,
        "cacheRead": null,
        "cacheWrite": null,
        "providerReportedTotal": 0
      },
      "subagentDurationMsTotal": 0,
      "subagentFailures": 0,
      "toolCallCount": 8,
      "diff": null,
      "verify": null
    },
    "manualAssessment": {
      "solvedWithoutCorrection": null,
      "unnecessaryLineChangesWithinScope": null,
      "lostRequirements": null,
      "repeatedFailuresWithoutContextChange": null,
      "decisionPersistenceAfterCompaction": null,
      "projectStatusCorrectness": null,
      "hallucinationCount": null,
      "notes": null
    }
  },
  "diff": {
    "schemaVersion": "1",
    "head": "7300fc54172e6be74bf5c1955ebbd3e0190f43aa",
    "staged": [],
    "unstaged": [
      {
        "status": "M",
        "path": "benchmark-fixture/diff-viewer/change-tracker.ts"
      }
    ],
    "untracked": [],
    "renames": [],
    "deletions": [],
    "changedFiles": [
      "benchmark-fixture/diff-viewer/change-tracker.ts"
    ],
    "fingerprint": "4fc1bda302df0e9f6cb94f10a09b2eea39c823a50a8a9b38acad890850094da6",
    "diffFingerprint": "4fc1bda302df0e9f6cb94f10a09b2eea39c823a50a8a9b38acad890850094da6",
    "visibleTestChanges": [],
    "benchmarkChanges": []
  },
  "networkToolCallsObserved": 0
}
